ffff9c9b5febfcc0 234431581 S Ci:1:006:0 s 80 06 0100 0000 0012 18 <
ffff9c9b5febfcc0 234431824 C Ci:1:006:0 0 18 = 12010002 00000008 f304030c 38010102 0001
ffff9c9b5febfcc0 234432133 S Ci:1:006:0 s 80 06 0200 0000 0009 9 <
ffff9c9b5febfcc0 234435761 C Ci:1:006:0 0 9 = 09023e00 01010080 32
ffff9c9b0ece7300 234536064 S Ci:1:006:0 s 80 06 0200 0000 003e 62 <
ffff9c9b0ece7300 234536494 C Ci:1:006:0 0 62 = 09023e00 01010080 32090400 0005ff00 00000921 10010001 22150007 05810240
ffff9c9b5febf540 240436291 S Ci:1:006:0 s 80 06 0100 0000 0040 64 <
ffff9c9b5febf540 240436514 C Ci:1:006:0 0 18 = 12010002 00000008 f304030c 38010102 0001
ffff9c9b0ece7300 240482267 S Ci:1:006:0 s 80 06 0100 0000 0012 18 <
ffff9c9b0ece7300 240482502 C Ci:1:006:0 0 18 = 12010002 00000008 f304030c 38010102 0001
ffff9c9b0ece7300 240485480 S Ci:1:006:0 s 80 06 0200 0000 00ff 255 <
ffff9c9b0ece7300 240485916 C Ci:1:006:0 0 62 = 09023e00 01010080 32090400 0005ff00 00000921 10010001 22150007 05810240
ffff9c9b0ece7300 240492755 S Ci:1:006:0 s 80 06 0300 0000 00ff 255 <
ffff9c9b0ece7300 240492899 C Ci:1:006:0 0 4 = 04030904
ffff9c9b0ece7300 240496333 S Ci:1:006:0 s 80 06 0302 0409 00ff 255 <
ffff9c9b0ece7300 240496641 C Ci:1:006:0 0 34 = 22034500 4c004100 4e003a00 46006900 6e006700 65007200 70007200 69006e00
ffff9c9b0a51e480 240537521 S Ci:1:006:0 s 80 06 0600 0000 000a 10 <
ffff9c9b0a51e480 240537619 C Ci:1:006:0 -32 0
ffff9c9b5e272480 242198930 S Ci:1:006:0 s 80 06 0100 0000 0012 18 <
ffff9c9b5e272480 242199130 C Ci:1:006:0 0 18 = 12010002 00000008 f304030c 38010102 0001
ffff9c9b5e272480 242202158 S Ci:1:006:0 s 80 06 0200 0000 0009 9 <
ffff9c9b5e272480 242202323 C Ci:1:006:0 0 9 = 09023e00 01010080 32
ffff9c9b5e272480 242205329 S Ci:1:006:0 s 80 06 0200 0000 003e 62 <
ffff9c9b5e272480 242205736 C Ci:1:006:0 0 62 = 09023e00 01010080 32090400 0005ff00 00000921 10010001 22150007 05810240
ffff9c9b5e272f00 242208613 S Ci:1:006:0 s 80 00 0000 0000 0002 2 <
ffff9c9b5e272f00 242208663 C Ci:1:006:0 0 2 = 0000
ffff9c9b5e272f00 242249248 S Ci:1:006:0 s 80 06 0100 0000 0012 18 <
ffff9c9b5e272f00 242249455 C Ci:1:006:0 0 18 = 12010002 00000008 f304030c 38010102 0001
ffff9c9b5e272840 242256846 S Bo:1:006:1 -115 2 = 000c
ffff9c9b5e272840 242256875 C Bo:1:006:1 0 2 >
ffff9c9b5e272540 242261200 S Bi:1:006:3 -115 64 <
ffff9c9b5e272540 242261264 C Bi:1:006:3 0 4 = 60006000
ffff9c9b5e272c00 242269722 S Bo:1:006:1 -115 2 = 0009
ffff9c9b5e272c00 242269759 C Bo:1:006:1 0 2 >
ffff9c9b0efc5b40 242331372 S Bi:1:006:2 -115 6400 <
ffff9c9b0efc5b40 242350764 C Bi:1:006:2 0 6400 = 15193c18 1619c518 0217b617 85172517 7817f316 bc162718 de17bd17 3717a117
ffff9c9b5febf000 242350926 S Bi:1:006:2 -115 12032 <
ffff9c9b5febf000 242387660 C Bi:1:006:2 0 12032 = c81aad18 5a19f317 f818de17 8f181219 2a18c417 54182317 74171118 d416e815
ffff9c9b5e272c00 243548651 S Bo:1:006:1 -115 2 = 407d
ffff9c9b5e272c00 243548679 C Bo:1:006:1 0 2 >
ffff9c9b0efc5b40 243567482 S Bi:1:006:3 -115 64 <
ffff9c9b0efc5b40 243567529 C Bi:1:006:3 0 1 = 12
ffff9c9b5e272900 243574058 S Bo:1:006:1 -115 3 = 40bd12
ffff9c9b5e272900 243574086 C Bo:1:006:1 0 3 >
ffff9c9b5febf9c0 243580366 S Bo:1:006:1 -115 3 = 40a878
ffff9c9b5febf9c0 243580409 C Bo:1:006:1 0 3 >
ffff9c9b0efc5b40 243588440 S Bo:1:006:1 -115 2 = 4068
ffff9c9b0efc5b40 243588465 C Bo:1:006:1 0 2 >
ffff9c9b5e272900 243641945 S Bi:1:006:3 -115 64 <
ffff9c9b5e272900 243641994 C Bi:1:006:3 0 1 = 38
ffff9c9b5e272900 243662162 S Bo:1:006:1 -115 2 = 4067
ffff9c9b5e272900 243662188 C Bo:1:006:1 0 2 >
ffff9c9b5e272900 243668645 S Bi:1:006:3 -115 64 <
ffff9c9b5e272900 243668694 C Bi:1:006:3 0 1 = 7f
ffff9c9b5e272900 243684737 S Bo:1:006:1 -115 2 = 4047
ffff9c9b5e272900 243684765 C Bo:1:006:1 0 2 >
ffff9c9b5e272900 243691239 S Bi:1:006:3 -115 64 <
ffff9c9b5e272900 243691291 C Bi:1:006:3 0 1 = c0
ffff9c9b5e272900 243697720 S Bo:1:006:1 -115 3 = 4087c0
ffff9c9b5e272900 243697748 C Bo:1:006:1 0 3 >
ffff9c9b5e272900 243700981 S Bo:1:006:1 -115 3 = 408a97
ffff9c9b5e272900 243701009 C Bo:1:006:1 0 3 >
ffff9c9b5e272900 243703177 S Bo:1:006:1 -115 3 = 408b72
ffff9c9b5e272900 243703204 C 