ffff9c9b602ddd80 293777300 S Ci:1:006:0 s 80 06 0100 0000 0012 18 <
ffff9c9b602ddd80 293777554 C Ci:1:006:0 0 18 = 12010002 00000008 f304030c 38010102 0001
ffff9c9b602ddd80 293777592 S Ci:1:006:0 s 80 06 0200 0000 0009 9 <
ffff9c9b602ddd80 293777761 C Ci:1:006:0 0 9 = 09023e00 01010080 32
ffff9c9b602dd480 293877849 S Ci:1:006:0 s 80 06 0200 0000 003e 62 <
ffff9c9b602dd480 293878244 C Ci:1:006:0 0 62 = 09023e00 01010080 32090400 0005ff00 00000921 10010001 22150007 05810240
ffff9c9b602dd9c0 303784761 S Ci:1:006:0 s 80 06 0100 0000 0040 64 <
ffff9c9b602dd9c0 303784984 C Ci:1:006:0 0 18 = 12010002 00000008 f304030c 38010102 0001
ffff9c9b602ddcc0 303887831 S Ci:1:006:0 s 80 06 0100 0000 0012 18 <
ffff9c9b602ddcc0 303888033 C Ci:1:006:0 0 18 = 12010002 00000008 f304030c 38010102 0001
ffff9c9b602dd240 303891000 S Ci:1:006:0 s 80 06 0200 0000 00ff 255 <
ffff9c9b602dd240 303891420 C Ci:1:006:0 0 62 = 09023e00 01010080 32090400 0005ff00 00000921 10010001 22150007 05810240
ffff9c9b602ddf00 303894173 S Ci:1:006:0 s 80 06 03ee 0000 0012 18 <
ffff9c9b602ddf00 303894279 C Ci:1:006:0 -32 0
ffff9c9b602dde40 303897342 S Ci:1:006:0 s 80 06 0300 0000 00ff 255 <
ffff9c9b602dde40 303897488 C Ci:1:006:0 0 4 = 04030904
ffff9c9b5f279f00 303900551 S Ci:1:006:0 s 80 06 0302 0409 00ff 255 <
ffff9c9b5f279f00 303900860 C Ci:1:006:0 0 34 = 22034500 4c004100 4e003a00 46006900 6e006700 65007200 70007200 69006e00
ffff9c9b5f279540 303903816 S Ci:1:006:0 s 80 06 0600 0000 000a 10 <
ffff9c9b5f279540 303903922 C Ci:1:006:0 -32 0
ffff9c9b5f2790c0 317004049 S Ci:1:006:0 s 80 06 0100 0000 0012 18 <
ffff9c9b5f2790c0 317004267 C Ci:1:006:0 0 18 = 12010002 00000008 f304030c 38010102 0001
ffff9c9b5f2790c0 317004276 S Ci:1:006:0 s 80 06 0200 0000 003e 62 <
ffff9c9b5f2790c0 317004684 C Ci:1:006:0 0 62 = 09023e00 01010080 32090400 0005ff00 00000921 10010001 22150007 05810240
ffff9c9b5f2790c0 317006376 S Co:1:006:0 s 00 09 0001 0000 0000 0
ffff9c9b5f2790c0 317006427 C Co:1:006:0 0 0
ffff9c9b5e2723c0 322337675 S Ci:1:006:0 s 80 06 0100 0000 0040 64 <
ffff9c9b5e2723c0 322337916 C Ci:1:006:0 0 18 = 12010002 00000008 f304030c 38010102 0001
ffff9c9b0ece79c0 322388021 S Ci:1:006:0 s 80 06 0100 0000 0012 18 <
ffff9c9b0ece79c0 322388234 C Ci:1:006:0 0 18 = 12010002 00000008 f304030c 38010102 0001
ffff9c9b0ece79c0 322391195 S Ci:1:006:0 s 80 06 0200 0000 00ff 255 <
ffff9c9b0ece79c0 322391622 C Ci:1:006:0 0 62 = 09023e00 01010080 32090400 0005ff00 00000921 10010001 22150007 05810240
ffff9c9b0ece79c0 322394373 S Ci:1:006:0 s 80 06 0300 0000 00ff 255 <
ffff9c9b0ece79c0 322394517 C Ci:1:006:0 0 4 = 04030904
ffff9c9b0ece79c0 322397641 S Ci:1:006:0 s 80 06 0302 0409 00ff 255 <
ffff9c9b0ece79c0 322397959 C Ci:1:006:0 0 34 = 22034500 4c004100 4e003a00 46006900 6e006700 65007200 70007200 69006e00
ffff9c9b0ece79c0 322400881 S Ci:1:006:0 s 80 06 0600 0000 000a 10 <
ffff9c9b0ece79c0 322401029 C Ci:1:006:0 -32 0
ffff9c9b0ece70c0 323782876 S Ci:1:006:0 s 80 06 0100 0000 0012 18 <
ffff9c9b0ece70c0 323783106 C Ci:1:006:0 0 18 = 12010002 00000008 f304030c 38010102 0001
ffff9c9b0ece70c0 323786150 S Ci:1:006:0 s 80 06 0200 0000 0009 9 <
ffff9c9b0ece70c0 323786351 C Ci:1:006:0 0 9 = 09023e00 01010080 32
ffff9c9b5e272900 323789343 S Ci:1:006:0 s 80 06 0200 0000 003e 62 <
ffff9c9b5e272900 323789782 C Ci:1:006:0 0 62 = 09023e00 01010080 32090400 0005ff00 00000921 10010001 22150007 05810240
ffff9c9b602dd900 323800938 S Ci:1:006:0 s 80 00 0000 0000 0002 2 <
ffff9c9b602dd900 323801045 C Ci:1:006:0 0 2 = 0000
ffff9c9b0ece7240 323865570 S Ci:1:006:0 s 80 06 0100 0000 0012 18 <
ffff9c9b0ece7240 323865783 C Ci:1:006:0 0 18 = 12010002 00000008 f304030c 38010102 0001
ffff9c9b602ddf00 323881265 S Bo:1:006:1 -115 2 = 000c
ffff9c9b602ddf00 323881304 C Bo:1:006:1 0 2 >
ffff9c9b602ddf00 323889680 S Bi:1:006:3 -115 64 <
ffff9c9b602ddf00 323889741 C Bi:1:006:3 0 4 = 60006000
ffff9c9b602ddf00 323900223 S Bo:1:006:1 -115 2 = 0009
ffff9c9b602ddf00 323900304 C Bo:1:006:1 0 2 >
ffff9c9b0ece76c0 323945721 S Bi:1:006:2 -115 7680 <
ffff9c9b0ece76c0 323969064 C Bi:1:006:2 0 7680 = 25195418 3c190519 1d17c417 f2175a17 a4171617