ffff9c9b0efc5240 85088699 S Ci:1:006:0 s 80 06 0100 0000 0012 18 <
ffff9c9b0efc5240 85088936 C Ci:1:006:0 0 18 = 12010002 00000008 f304030c 38010102 0001
ffff9c9b0efc5240 85088983 S Ci:1:006:0 s 80 06 0200 0000 0009 9 <
ffff9c9b0efc5240 85089138 C Ci:1:006:0 0 9 = 09023e00 01010080 32
ffff9c9b5e272480 85189229 S Ci:1:006:0 s 80 06 0200 0000 003e 62 <
ffff9c9b5e272480 85189609 C Ci:1:006:0 0 62 = 09023e00 01010080 32090400 0005ff00 00000921 10010001 22150007 05810240
ffff9c9b0a52a0c0 92399699 S Ci:1:006:0 s 80 06 0100 0000 0040 64 <
ffff9c9b0a52a0c0 92399917 C Ci:1:006:0 0 18 = 12010002 00000008 f304030c 38010102 0001
ffff9c9b5e272b40 92444205 S Ci:1:006:0 s 80 06 0100 0000 0012 18 <
ffff9c9b5e272b40 92444431 C Ci:1:006:0 0 18 = 12010002 00000008 f304030c 38010102 0001
ffff9c9b5e272480 92447374 S Ci:1:006:0 s 80 06 0200 0000 00ff 255 <
ffff9c9b5e272480 92447800 C Ci:1:006:0 0 62 = 09023e00 01010080 32090400 0005ff00 00000921 10010001 22150007 05810240
ffff9c9b5febf240 92450566 S Ci:1:006:0 s 80 06 0300 0000 00ff 255 <
ffff9c9b5febf240 92450708 C Ci:1:006:0 0 4 = 04030904
ffff9c9b5febf240 92453825 S Ci:1:006:0 s 80 06 0302 0409 00ff 255 <
ffff9c9b5febf240 92454121 C Ci:1:006:0 0 34 = 22034500 4c004100 4e003a00 46006900 6e006700 65007200 70007200 69006e00
ffff9c9b5febf240 92456996 S Ci:1:006:0 s 80 06 0600 0000 000a 10 <
ffff9c9b5febf240 92457067 C Ci:1:006:0 -32 0
ffff9c9b0a52acc0 92993276 S Ci:1:006:0 s 80 06 0100 0000 0012 18 <
ffff9c9b0a52acc0 92993478 C Ci:1:006:0 0 18 = 12010002 00000008 f304030c 38010102 0001
ffff9c9b0a52a0c0 92996454 S Ci:1:006:0 s 80 06 0200 0000 0009 9 <
ffff9c9b0a52a0c0 92996616 C Ci:1:006:0 0 9 = 09023e00 01010080 32
ffff9c9b0a52a0c0 92999619 S Ci:1:006:0 s 80 06 0200 0000 003e 62 <
ffff9c9b0a52a0c0 93000019 C Ci:1:006:0 0 62 = 09023e00 01010080 32090400 0005ff00 00000921 10010001 22150007 05810240
ffff9c9b0a52a0c0 93004035 S Ci:1:006:0 s 80 00 0000 0000 0002 2 <
ffff9c9b0a52a0c0 93004101 C Ci:1:006:0 0 2 = 0000
ffff9c9b0a52a0c0 93022908 S Ci:1:006:0 s 80 06 0100 0000 0012 18 <
ffff9c9b0a52a0c0 93023147 C Ci:1:006:0 0 18 = 12010002 00000008 f304030c 38010102 0001
ffff9c9b0a52a840 93032460 S Bo:1:006:1 -115 2 = 000c
ffff9c9b0a52a840 93032499 C Bo:1:006:1 0 2 >
ffff9c9b5febf6c0 93034598 S Bi:1:006:3 -115 64 <
ffff9c9b5febf6c0 93034650 C Bi:1:006:3 0 4 = 60006000
ffff9c9b5febf000 93036745 S Bo:1:006:1 -115 2 = 0009
ffff9c9b5febf000 93036770 C Bo:1:006:1 0 2 >
ffff9c9b5febf300 93043104 S Bi:1:006:2 -115 7296 <
ffff9c9b5febf300 93065234 C Bi:1:006:2 0 7296 = 4a199518 25194719 3f174c18 11189417 d6175217 51176c18 20184018 a017a817
ffff9c9afc02e540 93065331 S Bi:1:006:2 -115 11136 <
ffff9c9afc02e540 93099391 C Bi:1:006:2 0 11136 = bd185e19 ce194b1a 7c194f19 e119b518 3c19ca18 1a1a7c17 46197118 d6189619
ffff9c9b0a52a480 95198577 S Bo:1:006:1 -115 2 = 407d
ffff9c9b0a52a480 95198624 C Bo:1:006:1 0 2 >
ffff9c9b5e272c00 95219510 S Bi:1:006:3 -115 64 <
ffff9c9b5e272c00 95219602 C Bi:1:006:3 0 1 = 12
ffff9c9b5febf300 95232116 S Bo:1:006:1 -115 3 = 40bd12
ffff9c9b5febf300 95232203 C Bo:1:006:1 0 3 >
ffff9c9b0a52a900 95255140 S Bo:1:006:1 -115 3 = 40a878
ffff9c9b0a52a900 95255223 C Bo:1:006:1 0 3 >
ffff9c9b0a52ac00 95265625 S Bo:1:006:1 -115 2 = 4068
ffff9c9b0a52ac00 95265651 C Bo:1:006:1 0 2 >
ffff9c9b0a52a000 95272040 S Bi:1:006:3 -115 64 <
ffff9c9b0a52a000 95272104 C Bi:1:006:3 0 1 = 38
ffff9c9b0a52a540 95278491 S Bo:1:006:1 -115 2 = 4067
ffff9c9b0a52a540 95278518 C Bo:1:006:1 0 2 >
ffff9c9b5e272b40 95324052 S Bi:1:006:3 -115 64 <
ffff9c9b5e272b40 95324113 C Bi:1:006:3 0 1 = 7f
ffff9c9b5febf3c0 95360200 S Bo:1:006:1 -115 2 = 4047
ffff9c9b5febf3c0 95360239 C Bo:1:006:1 0 2 >
ffff9c9b5febf3c0 95363480 S Bi:1:006:3 -115 64 <
ffff9c9b5febf3c0 95363559 C Bi:1:006:3 0 1 = c0
ffff9c9b5febf9c0 95400860 S Bo:1:006:1 -115 3 = 4087c0
ffff9c9b5febf9c0 95400892 C Bo:1:006:1 0 3 >
ffff9c9b5febf240 95438245 S Bo:1:006:1 -115 3 = 408a97
ffff9c9b5febf240 95438319 C Bo:1:006:1 0 3 >
ffff9c9b5febf240 95475683 S Bo:1:006:1 -115 3 = 408b72
ffff9c9b5febf240 95475709 C Bo:1:006:1 0 3 >
ffff9c9b0a52a3c0 95484203 S Bo:1:006:1 -115 3 =