ffff9c9b5e272e40 362227594 S Ci:1:006:0 s 80 06 0100 0000 0012 18 <
ffff9c9b5e272e40 362227796 C Ci:1:006:0 0 18 = 12010002 00000008 f304030c 38010102 0001
ffff9c9b0ece7180 362228055 S Ci:1:006:0 s 80 06 0200 0000 0009 9 <
ffff9c9b0ece7180 362228210 C Ci:1:006:0 0 9 = 09023e00 01010080 32
ffff9c9b0ece7180 362328305 S Ci:1:006:0 s 80 06 0200 0000 003e 62 <
ffff9c9b0ece7180 362328712 C Ci:1:006:0 0 62 = 09023e00 01010080 32090400 0005ff00 00000921 10010001 22150007 05810240
ffff9c9b6141c300 368901414 S Ci:1:006:0 s 80 06 0100 0000 0040 64 <
ffff9c9b6141c300 368901659 C Ci:1:006:0 0 18 = 12010002 00000008 f304030c 38010102 0001
ffff9c9b6141ca80 368946489 S Ci:1:006:0 s 80 06 0100 0000 0012 18 <
ffff9c9b6141ca80 368946699 C Ci:1:006:0 0 18 = 12010002 00000008 f304030c 38010102 0001
ffff9c9b6141cf00 368949665 S Ci:1:006:0 s 80 06 0200 0000 00ff 255 <
ffff9c9b6141cf00 368950097 C Ci:1:006:0 0 62 = 09023e00 01010080 32090400 0005ff00 00000921 10010001 22150007 05810240
ffff9c9b6141c900 368953902 S Ci:1:006:0 s 80 06 0300 0000 00ff 255 <
ffff9c9b6141c900 368954035 C Ci:1:006:0 0 4 = 04030904
ffff9c9b6141c900 368957012 S Ci:1:006:0 s 80 06 0302 0409 00ff 255 <
ffff9c9b6141c900 368957296 C Ci:1:006:0 0 34 = 22034500 4c004100 4e003a00 46006900 6e006700 65007200 70007200 69006e00
ffff9c9b6141c900 368960186 S Ci:1:006:0 s 80 06 0600 0000 000a 10 <
ffff9c9b6141c900 368960280 C Ci:1:006:0 -32 0
ffff9c9b5f279d80 370945302 S Ci:1:006:0 s 80 06 0100 0000 0012 18 <
ffff9c9b5f279d80 370945516 C Ci:1:006:0 0 18 = 12010002 00000008 f304030c 38010102 0001
ffff9c9b5f279b40 370948596 S Ci:1:006:0 s 80 06 0200 0000 0009 9 <
ffff9c9b5f279b40 370948757 C Ci:1:006:0 0 9 = 09023e00 01010080 32
ffff9c9b5f2793c0 370951873 S Ci:1:006:0 s 80 06 0200 0000 003e 62 <
ffff9c9b5f2793c0 370952273 C Ci:1:006:0 0 62 = 09023e00 01010080 32090400 0005ff00 00000921 10010001 22150007 05810240
ffff9c9b5f279540 370955117 S Ci:1:006:0 s 80 00 0000 0000 0002 2 <
ffff9c9b5f279540 370955186 C Ci:1:006:0 0 2 = 0000
ffff9c9b5f279a80 370973212 S Ci:1:006:0 s 80 06 0100 0000 0012 18 <
ffff9c9b5f279a80 370973413 C Ci:1:006:0 0 18 = 12010002 00000008 f304030c 38010102 0001
ffff9c9b5f279840 370980815 S Bo:1:006:1 -115 2 = 000c
ffff9c9b5f279840 370980853 C Bo:1:006:1 0 2 >
ffff9c9b5f279240 371006135 S Bi:1:006:3 -115 64 <
ffff9c9b5f279240 371006202 C Bi:1:006:3 0 4 = 60006000
ffff9c9b5febf480 371018618 S Bo:1:006:1 -115 2 = 0009
ffff9c9b5febf480 371018658 C Bo:1:006:1 0 2 >
ffff9c9b5febfc00 371020746 S Bi:1:006:2 -115 7680 <
ffff9c9b5febfc00 371044072 C Bi:1:006:2 0 7680 = 32195518 1219e618 fb160218 db175417 96172217 f7166f18 1b180b18 7f17c817
ffff9c9b5febf540 371045590 S Bi:1:006:2 -115 10752 <
ffff9c9b5febf540 371078334 C Bi:1:006:2 0 10752 = cf18b219 691bd81a 1a189218 b3182c19 0c199217 fb19b718 ad188719 85180e19
ffff9c9b5f279780 372637193 S Bo:1:006:1 -115 2 = 407d
ffff9c9b5f279780 372637221 C Bo:1:006:1 0 2 >
ffff9c9b0ece76c0 372643549 S Bi:1:006:3 -115 64 <
ffff9c9b0ece76c0 372643600 C Bi:1:006:3 0 1 = 12
ffff9c9b0ece7180 372646756 S Bo:1:006:1 -115 3 = 40bd12
ffff9c9b0ece7180 372646785 C Bo:1:006:1 0 3 >
ffff9c9b0ece7540 372663461 S Bo:1:006:1 -115 3 = 40a878
ffff9c9b0ece7540 372663501 C Bo:1:006:1 0 3 >
ffff9c9b0ece7c00 372690504 S Bo:1:006:1 -115 2 = 4068
ffff9c9b0ece7c00 372690549 C Bo:1:006:1 0 2 >
ffff9c9b0ece7900 372692632 S Bi:1:006:3 -115 64 <
ffff9c9b0ece7900 372692696 C Bi:1:006:3 0 1 = 38
ffff9c9b6141c6c0 372699062 S Bo:1:006:1 -115 2 = 4067
ffff9c9b6141c6c0 372699106 C Bo:1:006:1 0 2 >
ffff9c9b6141c6c0 372705450 S Bi:1:006:3 -115 64 <
ffff9c9b6141c6c0 372705513 C Bi:1:006:3 0 1 = 7f
ffff9c9b6141c6c0 372707655 S Bo:1:006:1 -115 2 = 4047
ffff9c9b6141c6c0 372707695 C Bo:1:006:1 0 2 >
ffff9c9b6141c6c0 372709856 S Bi:1:006:3 -115 64 <
ffff9c9b6141c6c0 372709921 C Bi:1:006:3 0 1 = c0
ffff9c9b5f279240 372714212 S Bo:1:006:1 -115 3 = 4087c0
ffff9c9b5f279240 372714266 C Bo:1:006:1 0 3 >
ffff9c9b5f279840 372720696 S Bo:1:006:1 -115 3 = 408a97
ffff9c9b5f279840 372720723 C Bo:1:006:1 0 3 >
ffff9c9b5f279840 372731392 S Bo:1:006:1 -115 3 = 408b72
ffff9c9b5f279840 372731430 C 