ffff94cba4dabf00 2253887082 S Bo:1:006:1 -115 2 = 0009
ffff94cba4dabf00 2253887146 C Bo:1:006:1 0 2 >
ffff94cba4dab6c0 2253889253 S Bi:1:006:2 -115 6208 <
ffff94cba4dab6c0 2253908238 C Bi:1:006:2 0 6208 = 7e19bd18 2a194f19 55173518 0b186717 c0173117 06178c18 62181d18 d417d817
ffff94cd9a7149c0 2253908325 S Bi:1:006:2 -115 12224 <
ffff94cd9a7149c0 2253945671 C Bi:1:006:2 0 12224 = 4119c518 2f19fb16 d318b419 2a189f17 f217d817 1c17e318 da174e17 f7172119
ffff94cba4dabe40 2253962265 S Bo:1:006:1 -115 2 = 0009
ffff94cba4dabe40 2253962332 C Bo:1:006:1 0 2 >
ffff94cba4dab3c0 2253964539 S Bi:1:006:2 -115 6208 <
ffff94cba4dab3c0 2253983537 C Bi:1:006:2 0 6208 = 1f195318 0319ef18 0317fb17 d7173017 8a173117 c6163218 1a182118 6317ad17
ffff94cde0f83b40 2253983678 S Bi:1:006:2 -115 12224 <
ffff94cde0f83b40 2254021003 C Bi:1:006:2 0 12224 = 0919c318 2d19e216 c2188219 df176f17 a317c917 f916c518 c0173d17 a9170119
ffff94cd9a7149c0 2254045569 S Bo:1:006:1 -115 2 = 0009
ffff94cd9a7149c0 2254045636 C Bo:1:006:1 0 2 >
ffff94cd9a714f00 2254047786 S Bi:1:006:2 -115 6208 <
ffff94cd9a714f00 2254066776 C Bi:1:006:2 0 6208 = 54195b18 1319f318 29171c18 fb176217 b817fc16 df168018 12182318 9717d017
ffff94cde0f83b40 2254066916 S Bi:1:006:2 -115 12224 <
ffff94cde0f83b40 2254104247 C Bi:1:006:2 0 12224 = f618cc18 17191517 cc187a19 dd178317 80179b17 2b17b218 a6176e17 e5170419
ffff94cd9a714900 2254122329 S Bo:1:006:1 -115 2 = 0009
ffff94cd9a714900 2254122403 C Bo:1:006:1 0 2 >
ffff94cd9a714300 2254124607 S Bi:1:006:2 -115 6208 <
ffff94cd9a714300 2254143651 C Bi:1:006:2 0 6208 = 5b19a118 2b196719 19171318 26186217 af174517 39179918 2b183f18 5417cf17
ffff94cde0f83b40 2254143784 S Bi:1:006:2 -115 12224 <
ffff94cde0f83b40 2254181201 C Bi:1:006:2 0 12224 = f718ca18 3d191c17 dc18ca19 ca177717 9617b917 1e179c18 db177617 b6170219
